{
  "architecture": {
    "changed_nodes": [
      "ts:App",
      "ts:Board",
      "ts:Card",
      "ts:ClusterBadge",
      "ts:ClusterBadgeInner",
      "ts:ClusterHighlightWrapper",
      "ts:Column",
      "ts:ConsentPrompt",
      "ts:HiddenReposToggle",
      "ts:IssueSourceRow",
      "ts:PRCardView",
      "ts:PROriginFilter",
      "ts:PRSourceRow",
      "ts:PartialResultChip",
      "ts:ProposalCardView",
      "ts:ProposalSourceRow",
      "ts:RefreshButton",
      "ts:RepoBadge",
      "ts:SaveViewButton",
      "ts:SourceSwimlanes",
      "ts:SyncPointBanner",
      "ts:VendorSwimlanes",
      "ts:assertNever",
      "ts:bucketIssues",
      "ts:bucketPRs",
      "ts:bucketProposals",
      "ts:classify",
      "ts:classifyOrDefault",
      "ts:clusterBoardCards",
      "ts:deriveIssueRepo",
      "ts:determineConsensus",
      "ts:emitHighlight",
      "ts:extractVendor",
      "ts:fetchIssuesForSingleChange",
      "ts:fetchIssuesUnioned",
      "ts:fetchPRs",
      "ts:fetchProposals",
      "ts:fetchSyncStatus",
      "ts:filterByOrigin",
      "ts:formatRelative",
      "ts:getClusterKey",
      "ts:groupByVendor",
      "ts:hashString",
      "ts:isBrowser",
      "ts:isTauri",
      "ts:issueStatusToColumn",
      "ts:kanban-viz/src/App",
      "ts:kanban-viz/src/__tests__/fixtures",
      "ts:kanban-viz/src/__tests__/setup",
      "ts:kanban-viz/src/components/Board",
      "ts:kanban-viz/src/components/Card",
      "ts:kanban-viz/src/components/ClusterBadge",
      "ts:kanban-viz/src/components/Column",
      "ts:kanban-viz/src/components/ConsentPrompt",
      "ts:kanban-viz/src/components/HiddenReposToggle",
      "ts:kanban-viz/src/components/PRCardView",
      "ts:kanban-viz/src/components/PROriginFilter",
      "ts:kanban-viz/src/components/ProposalCardView",
      "ts:kanban-viz/src/components/RefreshButton",
      "ts:kanban-viz/src/components/RepoBadge",
      "ts:kanban-viz/src/components/SaveViewButton",
      "ts:kanban-viz/src/components/SourceSwimlanes",
      "ts:kanban-viz/src/components/SyncPointBanner",
      "ts:kanban-viz/src/components/VendorSwimlanes",
      "ts:kanban-viz/src/hooks/useBoardCards",
      "ts:kanban-viz/src/hooks/useCoordinator",
      "ts:kanban-viz/src/lib/coordinator-types",
      "ts:kanban-viz/src/lib/reversibility",
      "ts:kanban-viz/src/lib/runtime",
      "ts:kanban-viz/src/lib/saveView",
      "ts:kanban-viz/src/main",
      "ts:kanban-viz/src/vite-env.d",
      "ts:kanban-viz/vite.config",
      "ts:loadFromStorage",
      "ts:mintEventsToken",
      "ts:prStatusToColumn",
      "ts:proposalStatusToColumn",
      "ts:relativeTime",
      "ts:repoToColor",
      "ts:requiresConsent",
      "ts:saveBrowser",
      "ts:saveTauri",
      "ts:saveToStorage",
      "ts:saveView",
      "ts:shortForm",
      "ts:slugify",
      "ts:toIssueCard",
      "ts:useBoardCards",
      "ts:useCoordinator",
      "ts:useHighlightState"
    ],
    "delta_authoritative": false,
    "freshness": "stale"
  },
  "change_id": "introduce-fitness-function-gates",
  "checkpoint_status": "degraded",
  "context_impact": {
    "status": "unmigrated",
    "surfaces": [
      "apis",
      "documentation",
      "semantic_code"
    ]
  },
  "merge_base_revision": "d384a20874404d9e324a3069115ff64d92e0fa32",
  "namespace": {
    "key": "introduce-fitness-function-gates--wp-templates",
    "kind": "work_package"
  },
  "package_id": "wp-templates",
  "producer_results": [
    {
      "artifacts": [],
      "producer_id": "api.contracts",
      "producer_version": "1.0.0",
      "remediation": [],
      "status": "fresh",
      "validations": [
        {
          "status": "passed",
          "summary": "valid Draft 2020-12 schema",
          "validation_id": "schema:openspec-contracts-code-search-schemas-semantic-context-hit.schema.json"
        },
        {
          "status": "passed",
          "summary": "valid Draft 2020-12 schema",
          "validation_id": "schema:openspec-contracts-code-search-schemas-semantic-context-section.schema.json"
        },
        {
          "status": "passed",
          "summary": "valid Draft 2020-12 schema",
          "validation_id": "schema:openspec-contracts-gen-eval-framework-schemas-cli-contract.schema.json"
        },
        {
          "status": "passed",
          "summary": "valid Draft 2020-12 schema",
          "validation_id": "schema:openspec-contracts-phase-record-schemas-handoff-local-fallback.schema.json"
        },
        {
          "status": "passed",
          "summary": "valid Draft 2020-12 schema",
          "validation_id": "schema:openspec-contracts-phase-record-schemas-phase-record.schema.json"
        },
        {
          "status": "passed",
          "summary": "valid Draft 2020-12 schema",
          "validation_id": "schema:openspec-contracts-project-context-refresh-schemas-context-checkpoint.schema.json"
        },
        {
          "status": "passed",
          "summary": "valid Draft 2020-12 schema",
          "validation_id": "schema:openspec-contracts-project-context-refresh-schemas-context-convergence-record.schema.json"
        },
        {
          "status": "passed",
          "summary": "valid Draft 2020-12 schema",
          "validation_id": "schema:openspec-contracts-project-context-refresh-schemas-context-drift-gate.schema.json"
        },
        {
          "status": "passed",
          "summary": "valid Draft 2020-12 schema",
          "validation_id": "schema:openspec-contracts-project-context-refresh-schemas-context-refresh-manifest.schema.json"
        },
        {
          "status": "passed",
          "summary": "valid Draft 2020-12 schema",
          "validation_id": "schema:openspec-contracts-project-context-refresh-schemas-context-refresh-operation.schema.json"
        },
        {
          "status": "passed",
          "summary": "valid Draft 2020-12 schema",
          "validation_id": "schema:openspec-contracts-project-context-refresh-schemas-context-refresh-types.schema.json"
        },
        {
          "status": "passed",
          "summary": "valid Draft 2020-12 schema",
          "validation_id": "schema:openspec-contracts-prototyping-schemas-synthesis-plan.schema.json"
        },
        {
          "status": "passed",
          "summary": "valid Draft 2020-12 schema",
          "validation_id": "schema:openspec-contracts-prototyping-schemas-variant-descriptor.schema.json"
        },
        {
          "status": "passed",
          "summary": "valid Draft 2020-12 schema",
          "validation_id": "schema:openspec-contracts-semantic-context-evaluation-schemas-context-eval-case.schema.json"
        },
        {
          "status": "passed",
          "summary": "valid Draft 2020-12 schema",
          "validation_id": "schema:openspec-contracts-semantic-context-evaluation-schemas-context-eval-corpus.schema.json"
        },
        {
          "status": "passed",
          "summary": "valid Draft 2020-12 schema",
          "validation_id": "schema:openspec-contracts-semantic-context-evaluation-schemas-context-eval-report.schema.json"
        },
        {
          "status": "passed",
          "summary": "docs/architecture-analysis/contracts-inventory.md is current",
          "validation_id": "contracts-inventory"
        }
      ]
    },
    {
      "artifacts": [],
      "producer_id": "decisions.timeline",
      "producer_version": "1.0.0",
      "remediation": [],
      "status": "fresh",
      "validations": [
        {
          "status": "passed",
          "summary": "docs/decisions is current",
          "validation_id": "decisions"
        }
      ]
    },
    {
      "artifacts": [],
      "producer_id": "documentation.inventory",
      "producer_version": "1.0.0",
      "remediation": [],
      "status": "fresh",
      "validations": [
        {
          "status": "passed",
          "summary": "docs/architecture-analysis/skills-inventory.md is current",
          "validation_id": "skills-inventory"
        }
      ]
    },
    {
      "artifacts": [
        {
          "change": "modified",
          "path": "openspec/specs/agent-archetypes/spec.md",
          "sha256": "e018e3b21ed005eb52f96834a8f15f1c17f643fef666aee1758fe14de3f52af5"
        },
        {
          "change": "modified",
          "path": "openspec/specs/agent-coordinator/spec.md",
          "sha256": "2ecf596416268c7e5e05932f6c419853abab06dd580ef9e671d9769a35c1a408"
        },
        {
          "change": "added",
          "path": "openspec/specs/agent-trajectory-harness/spec.md",
          "sha256": "1a9898a19a4830cd351f05e9d2b0ae395e21aa2325b6d37c7d6e0c604c88e2cd"
        },
        {
          "change": "added",
          "path": "openspec/specs/ambient-review/spec.md",
          "sha256": "493d225c2abac95c830ec0616b7fe83d80b2ee4d040d171f7e1e242748d5325e"
        },
        {
          "change": "added",
          "path": "openspec/specs/approval-gate/spec.md",
          "sha256": "bb42523602a90b40010333a9bc62636e1b45bae589d298c072edf63bd3f2beaa"
        },
        {
          "change": "modified",
          "path": "openspec/specs/architecture-refresh/spec.md",
          "sha256": "86f1429dd07551d3c371265c43985a2f9c44de5164258578cb32fab523431f2b"
        },
        {
          "change": "modified",
          "path": "openspec/specs/coordination-bridge/spec.md",
          "sha256": "c28e1685c6c2375c72815ed42fbdfb96b20793916962c3689170b684c69dfe91"
        },
        {
          "change": "modified",
          "path": "openspec/specs/coordinator-kanban-viz/spec.md",
          "sha256": "6c65341520a7bb76217907d14faf2e180b9109637b925825c227e1fa0cc2f704"
        },
        {
          "change": "added",
          "path": "openspec/specs/cross-vendor-arbitrage/spec.md",
          "sha256": "354bcacf37568f29bbb56fffbe96492689998fd37c443e7c55341578679f85a7"
        },
        {
          "change": "modified",
          "path": "openspec/specs/evaluation-framework/spec.md",